{
  "$schema": "../../schemas/v1.7-performance-energy-awareness.schema.json",
  "schemaVersion": 1,
  "contractId": "goreecloud.glaze-ui.v1.7.performance-energy-awareness",
  "name": "Glaze UI V1.7 Performance and Energy Awareness Development Contract",
  "version": "1.7.0-dev.38",
  "lifecycle": "Development",
  "stableBaseline": "1.6.0",
  "consumerEligible": false,
  "planVersion": "v1.2",
  "v12SpecificationSections": [45],
  "governingPrinciple": "task-continuity-accessibility-responsiveness-and-semantic-state-outrank-animation-fidelity",
  "presentationDomains": [
    "theme",
    "material",
    "motion",
    "adaptive-transition",
    "decorative",
    "background-visual-work"
  ],
  "performanceModes": ["full","restrained","simplified","minimal","reduced-motion"],
  "dependencies": {
    "motionPerformance": "1.7.0-dev.25",
    "advancedThemeSystem": "1.7.0-dev.31",
    "accessibilityContinuity": "1.7.0-dev.34",
    "visualMotionDirection": "1.7.0-dev.36",
    "privacyAuthorityBoundaries": "1.7.0-dev.37"
  },
  "degradationPolicy": {
    "optionalVisualComplexityMayDegrade": true,
    "taskContinuityMayDegrade": false,
    "accessibilityMayDegrade": false,
    "responsivenessMayDegrade": false,
    "semanticStateMayDegrade": false,
    "authoritativeTruthMayDegrade": false,
    "directManipulationTrackingPreserved": true,
    "advancedThemeMeaningPreserved": true,
    "protectedSemanticColorMeaningPreserved": true,
    "materialHierarchyMeaningPreserved": true,
    "offscreenOptionalWorkSuspended": true,
    "backgroundOptionalWorkSuspended": true,
    "idleRenderLoopsAllowed": false,
    "continuousDecorativeAnimationDefault": false,
    "forcedFramesForOptionalVisualsAllowed": false
  },
  "energyPolicy": {
    "powerSavingMaySimplifyOptionalPresentation": true,
    "thermalConstraintMaySimplifyOptionalPresentation": true,
    "runtimePressureMaySimplifyOptionalPresentation": true,
    "constrainedHardwareMaySimplifyOptionalPresentation": true,
    "lowRefreshMaySimplifyOptionalPresentation": true,
    "nonVisibleOptionalWorkMaySuspend": true,
    "criticalTaskWorkRemainsAvailable": true,
    "energyStateCreatedByGlaze": false,
    "energyAcceptanceInferred": false
  },
  "requestPolicy": {
    "rawVisualComplexityAccepted": false,
    "rawBlurAccepted": false,
    "rawShaderAccepted": false,
    "rawParticleAccepted": false,
    "rawFrameForcingAccepted": false,
    "callerPerformanceThresholdsAccepted": false,
    "callerEnergyThresholdsAccepted": false,
    "acceptanceMeasurementsAcceptedByResolver": false
  },
  "evidence": {
    "measurementsManufactured": false,
    "performanceAcceptanceEstablished": false,
    "energyImpactEstablished": false,
    "batteryImpactEstablished": false,
    "thermalAcceptanceEstablished": false,
    "representativeDeviceAcceptanceEstablished": false
  },
  "acceptanceBoundary": {
    "sourceFoundationOnly": true,
    "section45Complete": false,
    "renderedAcceptanceEstablished": false,
    "nativePlatformAcceptanceEstablished": false,
    "assistiveTechnologyAcceptanceEstablished": false,
    "representativeDeviceAcceptanceEstablished": false,
    "measuredPerformanceAcceptanceEstablished": false,
    "energyAcceptanceEstablished": false,
    "thermalAcceptanceEstablished": false,
    "batteryAcceptanceEstablished": false,
    "backgroundLifecycleAcceptanceEstablished": false,
    "humanVisualMotionReviewEstablished": false,
    "downstreamConsumerAcceptanceAutomatic": false,
    "releasePromotionAutomatic": false,
    "deploymentAcceptanceAutomatic": false,
    "productionAcceptanceAutomatic": false
  },
  "runtimeEntrypoint": "js/glaze-v1.7-performance-energy-awareness.dev.mjs",
  "developmentAggregateEntrypoint": "js/glaze-v1.7-development.mjs",
  "tokenMap": "tokens/glaze-v1.7-performance-energy-awareness.dev.json",
  "researchRecord": "research/v1.7-performance-energy-awareness.md"
}
